{
  "description": "The type item for user elments",
  "id": 0,
  "isActive": true,
  "isBuiltIn": true,
  "modifiedBy": "alex@teambond.io",
  "name": "User",
  "sysEndTime": "9999-12-31 23:59:59.9999999",
  "sysStartTime": "2020-07-15 07:38:37.1928994",
  "uId": "7d5e6e8a-f562-479c-a808-9b3c5a8f9769",
  "isAssignable": true,
  "isAutoCollect": false,
  "isNotifiable": true,
  "isParentActive": false,
  "isTypeFunctionActive": true,
  "isRelational": true,
  "isKeyValue": false,
  "isInMemory": false,
  "isGraph": false,
  "isDocument": false,
  "isLedger": false,
  "isTimeSeries": false,
  "isSearch": false,
  "moduleUIdAutoCollect": "1357c174-6ebb-4009-a465-c396dea28ed8",
  "parentName": "",
  "parentUId": "",
  "sortOrder": 0,
  "typeFunctionModuleUId": "1357c174-6ebb-4009-a465-c396dea28ed8",
  "typeUnitName": "string",
  "typeUnitUId": "a232ba7f-2861-429d-8bbb-fe14f6c223e0",
  "uiExtensions": ""
}